{
  "$schema": "https://raw.githubusercontent.com/srpadrono/Pathfinder/main/skills/pathfinder/schema/journeys.schema.json",
  "version": "1.0.0",
  "project": "my-app",
  "framework": "playwright",
  "journeys": [
    {
      "id": "AUTH",
      "name": "Authentication",
      "steps": [
        {
          "id": "AUTH-01",
          "action": "User opens login page",
          "screen": "LoginView",
          "tested": false
        },
        {
          "id": "AUTH-02",
          "action": "User enters credentials and submits",
          "screen": "LoginView",
          "tested": false
        },
        {
          "id": "AUTH-03",
          "action": "User sees dashboard after login",
          "screen": "DashboardView",
          "tested": false
        }
      ]
    },
    {
      "id": "ERROR",
      "name": "Error Handling",
      "steps": [
        {
          "id": "ERROR-01",
          "action": "API call fails during login",
          "screen": "LoginView",
          "tested": false
        },
        {
          "id": "ERROR-02",
          "action": "Error alert shown with retry option",
          "screen": "LoginView",
          "tested": false
        }
      ]
    }
  ]
}
